{
    "$schema": "../../../models/schemas/namespaces/smsTemplates.schema.json",
    "dangerZone": {
        "remove": {
            "action": "Remove Template",
            "heading": "Remove Template",
            "message": "This action will remove the selected template and you will lose any changes you've done to this template."
        },
        "revert": {
            "action": "Revert",
            "heading": "Revert to default",
            "message": "This action will revert the selected template to default and you will lose any changes you've done to this template."
        }
    },
    "form": {
        "inputs": {
            "body": {
                "charLengthWarning": "Consult with your SMS service provider for the maximum character limit.",
                "hint": "You can utilize placeholder variables within the SMS body.",
                "label": "SMS Body",
                "placeholder": "Enter the SMS content"
            },
            "locale": {
                "label": "Locale",
                "placeholder": "Select Locale"
            },
            "template": {
                "hint": "Select the SMS template",
                "label": "SMS Template",
                "placeholder": "Select the SMS template"
            }
        }
    },
    "notifications": {
        "deleteSmsTemplate": {
            "error": {
                "description": "Error while deleting SMS template. Please try again",
                "message": "Error while deleting the SMS template"
            },
            "success": {
                "description": "SMS template deleted successfully",
                "message": "SMS template deleted successfully"
            }
        },
        "getSmsTemplate": {
            "error": {
                "description": "An error occurred while retrieving the SMS template.",
                "message": "Error retrieving SMS template."
            }
        },
        "getSmsTemplateList": {
            "error": {
                "description": "An error occurred while retrieving the SMS templates.",
                "message": "An error occurred while retrieving the SMS templates"
            }
        },
        "updateSmsTemplate": {
            "error": {
                "description": "Error while updating SMS template. Make sure you have filled all the required fields and try again",
                "message": "Error while updating SMS template"
            },
            "success": {
                "description": "SMS template updated successfully",
                "message": "SMS template updated successfully"
            }
        }
    },
    "page": {
        "description": "Customize sms templates used in your organization.",
        "header": "SMS Templates"
    },
    "tabs": {
        "content": {
            "label": "Content"
        },
        "preview": {
            "label": "Preview"
        }
    }
}
